	Identifier                                : 0x0d (QSFP+)
	Extended identifier                       : 0xdc
	Extended identifier description           : 3.5W max. Power consumption
	Extended identifier description           : CDR present in TX, CDR present in RX
	Extended identifier description           : High Power Class (> 3.5 W) not enabled
	Connector                                 : 0x07 (LC)
	Transceiver codes                         : 0x00 0x00 0x00 0x00 0x00 0x00 0x00 0x00
	Encoding                                  : 0x05 (64B/66B)
	BR, Nominal                               : 20600Mbps
	Rate identifier                           : 0x00
	Length (SMF,km)                           : 0km
	Length (OM3 50um)                         : 100m
	Length (OM2 50um)                         : 0m
	Length (OM1 62.5um)                       : 0m
	Length (Copper or Active cable)           : 0m
	Transmitter technology                    : 0x00 (850 nm VCSEL)
	Laser wavelength                          : 850.000nm
	Laser wavelength tolerance                : 10.000nm
	Vendor name                               : CISCO-AVAGO
	Vendor OUI                                : 00:17:6a
	Vendor PN                                 : AFBR-79EBPZ-CS2
	Vendor rev                                : 01
	Vendor SN                                 : AVM1906U03T
	Revision Compliance                       : Revision not specified
	Module temperature                        : 0.00 degrees C / 32.00 degrees F
	Module voltage                            : 0.0000 V
