	Identifier                                : 0x11 (QSFP28)
	Extended identifier                       : 0x8c
	Extended identifier description           : 2.5W max. Power consumption
	Extended identifier description           : CDR present in TX, CDR present in RX
	Extended identifier description           : High Power Class (> 3.5 W) not enabled
	Connector                                 : 0x0c (MPO Parallel Optic)
	Transceiver codes                         : 0x80 0x00 0x00 0x00 0x00 0x00 0x00 0x00
	Transceiver type                          : 100G Ethernet: 100G Base-SR4 or 25GBase-SR
	Encoding                                  : 0x07 ((256B/257B (transcoded FEC-enabled data))
	BR, Nominal                               : 25500Mbps
	Rate identifier                           : 0x00
	Length (SMF,km)                           : 0km
	Length (OM3 50um)                         : 70m
	Length (OM2 50um)                         : 0m
	Length (OM1 62.5um)                       : 0m
	Length (Copper or Active cable)           : 50m
	Transmitter technology                    : 0x00 (850 nm VCSEL)
	Laser wavelength                          : 850.000nm
	Laser wavelength tolerance                : 10.000nm
	Vendor name                               : FINISAR CORP
	Vendor OUI                                : 00:90:65
	Vendor PN                                 : FTLC9558REPM
	Vendor rev                                : A1
	Vendor SN                                 : X57AZDZ
	Revision Compliance                       : Unallocated
	Module temperature                        : 27.61 degrees C / 81.69 degrees F
	Module voltage                            : 3.3349 V
	Alarm/warning flags implemented           : Yes
	Laser tx bias current (Channel 1)         : 8.382 mA
	Laser tx bias current (Channel 2)         : 8.382 mA
	Laser tx bias current (Channel 3)         : 8.382 mA
	Laser tx bias current (Channel 4)         : 8.258 mA
	Transmit avg optical power (Channel 1)    : 1.0450 mW / 0.19 dBm
	Transmit avg optical power (Channel 2)    : 1.0729 mW / 0.31 dBm
	Transmit avg optical power (Channel 3)    : 1.0449 mW / 0.19 dBm
	Transmit avg optical power (Channel 4)    : 1.1227 mW / 0.50 dBm
	Rcvr signal avg optical power(Channel 1)  : 0.8644 mW / -0.63 dBm
	Rcvr signal avg optical power(Channel 2)  : 0.8673 mW / -0.62 dBm
	Rcvr signal avg optical power(Channel 3)  : 0.8364 mW / -0.78 dBm
	Rcvr signal avg optical power(Channel 4)  : 0.8026 mW / -0.96 dBm
	Laser bias current high alarm   (Chan 1)  : Off
	Laser bias current low alarm    (Chan 1)  : Off
	Laser bias current high warning (Chan 1)  : Off
	Laser bias current low warning  (Chan 1)  : Off
	Laser bias current high alarm   (Chan 2)  : Off
	Laser bias current low alarm    (Chan 2)  : Off
	Laser bias current high warning (Chan 2)  : Off
	Laser bias current low warning  (Chan 2)  : Off
	Laser bias current high alarm   (Chan 3)  : Off
	Laser bias current low alarm    (Chan 3)  : Off
	Laser bias current high warning (Chan 3)  : Off
	Laser bias current low warning  (Chan 3)  : Off
	Laser bias current high alarm   (Chan 4)  : Off
	Laser bias current low alarm    (Chan 4)  : Off
	Laser bias current high warning (Chan 4)  : Off
	Laser bias current low warning  (Chan 4)  : Off
	Module temperature high alarm             : Off
	Module temperature low alarm              : Off
	Module temperature high warning           : Off
	Module temperature low warning            : Off
	Module voltage high alarm                 : Off
	Module voltage low alarm                  : Off
	Module voltage high warning               : Off
	Module voltage low warning                : Off
	Laser tx power high alarm   (Channel 1)   : Off
	Laser tx power low alarm    (Channel 1)   : Off
	Laser tx power high warning (Channel 1)   : Off
	Laser tx power low warning  (Channel 1)   : Off
	Laser tx power high alarm   (Channel 2)   : Off
	Laser tx power low alarm    (Channel 2)   : Off
	Laser tx power high warning (Channel 2)   : Off
	Laser tx power low warning  (Channel 2)   : Off
	Laser tx power high alarm   (Channel 3)   : Off
	Laser tx power low alarm    (Channel 3)   : Off
	Laser tx power high warning (Channel 3)   : Off
	Laser tx power low warning  (Channel 3)   : Off
	Laser tx power high alarm   (Channel 4)   : Off
	Laser tx power low alarm    (Channel 4)   : Off
	Laser tx power high warning (Channel 4)   : Off
	Laser tx power low warning  (Channel 4)   : Off
	Laser rx power high alarm   (Channel 1)   : Off
	Laser rx power low alarm    (Channel 1)   : Off
	Laser rx power high warning (Channel 1)   : Off
	Laser rx power low warning  (Channel 1)   : Off
	Laser rx power high alarm   (Channel 2)   : Off
	Laser rx power low alarm    (Channel 2)   : Off
	Laser rx power high warning (Channel 2)   : Off
	Laser rx power low warning  (Channel 2)   : Off
	Laser rx power high alarm   (Channel 3)   : Off
	Laser rx power low alarm    (Channel 3)   : Off
	Laser rx power high warning (Channel 3)   : Off
	Laser rx power low warning  (Channel 3)   : Off
	Laser rx power high alarm   (Channel 4)   : Off
	Laser rx power low alarm    (Channel 4)   : Off
	Laser rx power high warning (Channel 4)   : Off
	Laser rx power low warning  (Channel 4)   : Off
	Laser bias current high alarm threshold   : 13.000 mA
	Laser bias current low alarm threshold    : 3.000 mA
	Laser bias current high warning threshold : 11.000 mA
	Laser bias current low warning threshold  : 5.000 mA
	Laser output power high alarm threshold   : 3.1623 mW / 5.00 dBm
	Laser output power low alarm threshold    : 0.1000 mW / -10.00 dBm
	Laser output power high warning threshold : 1.9953 mW / 3.00 dBm
	Laser output power low warning threshold  : 0.1585 mW / -8.00 dBm
	Module temperature high alarm threshold   : 75.00 degrees C / 167.00 degrees F
	Module temperature low alarm threshold    : -5.00 degrees C / 23.00 degrees F
	Module temperature high warning threshold : 70.00 degrees C / 158.00 degrees F
	Module temperature low warning threshold  : 0.00 degrees C / 32.00 degrees F
	Module voltage high alarm threshold       : 3.6300 V
	Module voltage low alarm threshold        : 2.9700 V
	Module voltage high warning threshold     : 3.4650 V
	Module voltage low warning threshold      : 3.1350 V
	Laser rx power high alarm threshold       : 2.1878 mW / 3.40 dBm
	Laser rx power low alarm threshold        : 0.0398 mW / -14.00 dBm
	Laser rx power high warning threshold     : 1.7378 mW / 2.40 dBm
	Laser rx power low warning threshold      : 0.0794 mW / -11.00 dBm
